{
  "artifact_type": "ApprovalGrant",
  "schema_version": "v1",
  "approval_grant_id": "approval-grant-001",
  "change_session_id": "analysis-case-001",
  "analysis_case_id": "analysis-case-001",
  "edit_packet_id": "edit-packet-001",
  "impact_report_id": "impact-report-001",
  "confirmation_id": "confirmation-001",
  "project_id": "project-001",
  "repository_id": "repository-001",
  "base_repository_revision": "ad23d0a7a54ce196c0ea6c41445e5f5492ae1ea6",
  "editable_files": ["src/main/java/example/ExpenseService.java"],
  "read_only_files": ["src/main/java/example/ExpenseRepository.java"],
  "test_files": ["src/test/java/example/ExpenseServiceTest.java"],
  "allowed_actions": ["read", "modify", "add_test", "run_test", "record_result", "execute_ui", "record_evidence"],
  "command_profile_version_id": "command-profile-version-001",
  "allowed_test_command_refs": ["targeted-unit", "module-integration"],
  "allowed_ui_scenarios": ["expense-filter-default-all"],
  "forbidden_globs": ["**/.env", "**/pom.xml"],
  "approved_by": "reviewer@example.invalid",
  "expires_at": "2026-07-31T12:00:00Z",
  "out_of_scope_policy": "collect_and_request_once"
}
